{
  "eventId": "01J8ZP6M5E4RH0K7Y2N9A3TQ03",
  "eventVersion": 1,
  "occurredAt": "2026-09-18T15:42:10Z",
  "orderId": "ORD-CO-000201",
  "market": "CO",
  "currency": "COP",
  "clientId": "CLI-20001",
  "channel": "C1",
  "items": [
    { "productId": "PRD-005", "quantity": 20, "unitPrice": 7800 },
    { "productId": "PRD-006", "quantity": 5, "unitPrice": 15250.5 }
  ]
}
