{
  "eventId": "01J8ZP6M5E4RH0K7Y2N9A3TQ20",
  "eventVersion": 1,
  "occurredAt": "2026-09-18T15:42:10Z",
  "orderId": "ORD-MX-000147",
  "market": "MX",
  "currency": "MXN",
  "clientId": "CLI-99821",
  "channel": "C1",
  "items": [
    { "productId": "PRD-001", "quantity": 999, "unitPrice": 1.0 }
  ]
}
